{
  "schemaVersion": "1.3",
  "packageId": "AI-NVM-OPPORTUNITIES-2026-08-26",
  "titleEn": "AI NVM Opportunities — Persistent State at the Right Boundary",
  "titleZh": "AI NVM 機會地圖——讓持久狀態留在正確的系統邊界",
  "researchFreeze": "2026-08-26",
  "sourceDocument": {
    "title": "Architecture Vision: Open Silicon Photonics for AI Systems",
    "version": "1.0.6",
    "date": "2026-07",
    "sha256": "1D47F0DE27BB1BF1FCCE6822BF7DE9230F6D511BD49F2AEEA657A3C2AB9826CE",
    "publicationStatus": "OCP Server Workgroup contribution; not an adopted OCP specification",
    "officialListingUrl": "https://www.opencompute.org/wiki/Server/Working",
    "documentUrl": "https://drive.google.com/file/d/1VODBOiUpNS8bLWpfNfbyBtdBLhtIAsEm/view?usp=sharing",
    "contributor": "Lightmatter",
    "custodian": "Open Compute Project Server Project",
    "authorityScope": "Officially listed contribution presented in the July 2026 Server Project call; supports attribution to the contribution, not OCP-wide normative requirements"
  },
  "centralThesisEn": "AI systems do not need more nonvolatile bits everywhere. They need the right persistent state at each boundary.",
  "centralThesisZh": "AI 系統需要的不是到處增加 NVM，而是讓每一個系統邊界保存正確的狀態。",
  "criticalBoundaryEn": "The supplied OCP photonics paper contains no OTP-memory requirement; its MTP occurrences refer to MPO/MTP optical connectors. Separate primary sources now establish JEDEC DDR5 PMIC MTP, DDR5 SPD Hub rewritable NVM, and BMC immutable-security-state requirements. Every other OTP/MTP placement remains an architecture inference unless its cited source establishes it.",
  "criticalBoundaryZh": "提供的 OCP photonics 論文沒有提出 OTP 記憶體需求，其中的 MTP 均指 MPO／MTP 光纖接頭；但本資料包已另以一級來源建立 JEDEC DDR5 PMIC MTP、DDR5 SPD Hub 可重寫 NVM，以及 BMC 不可變安全狀態要求。其餘 OTP／MTP 配置，除非引用來源明確建立，仍標示為架構推論。",
  "copilotAnswerRuleEn": "Return the claim with claim status, evidence class, assurance maturity, source URL or source locator, scope, limitation, reviewed date and open question. Never present an inferred storage placement as a source requirement.",
  "copilotAnswerRuleZh": "回答時必須同時提供主張、主張狀態、證據類別、確證成熟度、來源網址或來源定位、適用範圍、限制、審閱日期與待確認問題；不得把推論出的儲存配置描述成來源要求。",
  "evidenceClassDefinitions": [
    {
      "code": "DIRECT_REQUIREMENT",
      "labelEn": "Direct requirement",
      "labelZh": "直接要求",
      "definitionEn": "The cited standards or architecture source explicitly states the function or contract.",
      "definitionZh": "引用的標準或架構來源明確提出該功能或介面契約。"
    },
    {
      "code": "FIRST_PARTY_CASE",
      "labelEn": "Official product case",
      "labelZh": "官方產品案例",
      "definitionEn": "A shipped product or official implementation demonstrates the cited behavior.",
      "definitionZh": "已出貨產品或官方實作證明了所引用的行為。"
    },
    {
      "code": "TECHNICAL_EVIDENCE",
      "labelEn": "Technical evidence",
      "labelZh": "技術證據",
      "definitionEn": "A peer-reviewed implementation or independent physical analysis directly supports the cited mechanism or constraint.",
      "definitionZh": "同儕審查實作或獨立物理分析直接支持所引用的機制或限制。"
    },
    {
      "code": "VENDOR_CAPABILITY",
      "labelEn": "Vendor capability",
      "labelZh": "供應商能力宣告",
      "definitionEn": "A vendor describes an IP or product envelope; this is not independent assurance.",
      "definitionZh": "供應商描述其 IP 或產品能力範圍，但不代表獨立確證。"
    },
    {
      "code": "INFERRED_OPPORTUNITY",
      "labelEn": "Inferred opportunity",
      "labelZh": "推論機會",
      "definitionEn": "The storage placement is derived from a system need and is not a requirement of the cited source.",
      "definitionZh": "儲存配置由系統需求推導而來，並非引用來源的明文要求。"
    },
    {
      "code": "VALIDATION_NEEDED",
      "labelEn": "Validation needed",
      "labelZh": "需要驗證",
      "definitionEn": "Node, workload, security or lifecycle evidence is still required before selection.",
      "definitionZh": "選型前仍需補齊製程節點、工作負載、安全性或生命週期證據。"
    }
  ],
  "researchInputs": [
    {
      "inputId": "AI-NVM-INPUT-NBLM-001",
      "title": "The AI Peripheral Blueprint",
      "origin": "NotebookLM synthesis supplied by user",
      "format": "PDF",
      "pageCount": 13,
      "sha256": "897284470142A69DCB1E4F849A534D12C5C6494C5325FBA38B1D1D54F81EF41A",
      "suppliedDate": "2026-08-25",
      "classification": "Public",
      "status": "UNVERIFIED_SYNTHESIS",
      "citationStatus": "PRIMARY_SOURCES_NOT_DISCLOSED",
      "publicationStatus": "RESEARCH_INTAKE_ONLY",
      "canonicalRecordEligible": false,
      "sourceLocator": "PDF pp1-13",
      "evidenceDispositionEn": "Source-discovery and hypothesis input only; this synthesis is not primary evidence and cannot establish a product, standards or market requirement. The PDF is an image-only NotebookLM synthesis with no visible citations or reference list. Page locators identify synthesis claims only—not upstream evidence.",
      "evidenceDispositionZh": "僅供來源探索與假設形成；此綜整不是一級證據，不能建立產品、標準或市場要求。此 PDF 為影像式 NotebookLM 綜整，未提供可見引用或參考文獻；頁碼僅定位綜整主張，不代表上游證據。",
      "permittedUseEn": "Use the domain map to prioritize standards clauses, product documents, workload measurements and target-customer discovery.",
      "permittedUseZh": "可用其領域地圖排列標準條文、產品文件、工作負載量測與目標客戶訪談的驗證優先順序。",
      "excludedUseEn": "Do not repeat its volume figures, mandatory-technology language, yield claims or physical-invisibility claims without independent primary evidence.",
      "excludedUseZh": "在沒有獨立一級證據前，不得轉述其數量、強制技術、良率或物理不可見等主張。",
      "hypotheses": [
        {
          "hypothesisId": "AI-NVM-HYP-NBLM-001",
          "titleEn": "Companion-chip expansion is a market-sizing hypothesis",
          "titleZh": "周邊晶片擴張仍是待量化的市場假設",
          "status": "VALIDATION_NEEDED",
          "evidenceClass": "VALIDATION_NEEDED",
          "assuranceMaturity": "Open",
          "statementEn": "AI platforms may create recurring persistence contracts across SPD hubs and PMICs, retimers, BMCs, storage and network controllers, and memory-repair domains.",
          "statementZh": "AI 平台可能在 SPD hub／PMIC、retimer、BMC、儲存與網路控制器及記憶體修復領域形成重複出現的持久狀態契約。",
          "excludedClaimEn": "The synthesis does not prove any platform quantity, universal upgrade cycle or addressable-market multiplier.",
          "excludedClaimZh": "此綜整不能證明任何平台數量、通用升級週期或可服務市場倍數。",
          "validationNeededEn": "Validate platform bills of material, architecture ownership and current product roadmaps by deployment class.",
          "validationNeededZh": "需依部署類型驗證平台 BOM、架構責任歸屬與現行產品 roadmap。",
          "sourceLocator": "PDF pp2-3, 12-13",
          "relatedRecordIds": ["AI-NVM-INF-002", "AI-NVM-INF-003", "AI-NVM-DDR5-001", "AI-NVM-DDR5-002", "AI-NVM-BMC-001", "AI-NVM-BMC-002"],
          "isInference": true,
          "canonicalRecordEligible": false,
          "proofModeEligible": false,
          "sourceGroundedEligible": false
        },
        {
          "hypothesisId": "AI-NVM-HYP-NBLM-002",
          "titleEn": "DDR5 standards establish the sockets; the implementation envelope remains product-specific",
          "titleZh": "DDR5 標準已建立應用位置，實作範圍仍依產品而定",
          "status": "VALIDATION_NEEDED",
          "evidenceClass": "VALIDATION_NEEDED",
          "assuranceMaturity": "Open",
          "statementEn": "JEDEC establishes MTP NVM in the DDR5 PMIC and a 1024-byte rewritable NVM in the DDR5 SPD Hub. Capacity options, cycle count, PVT, atomicity, recovery and the exact embedded-memory implementation remain product-specific.",
          "statementZh": "JEDEC 已建立 DDR5 PMIC 的 MTP NVM，以及 DDR5 SPD Hub 的 1024-byte 可重寫 NVM；容量選項、循環次數、PVT、atomicity、recovery 與確切 embedded-memory 實作仍依產品而定。",
          "excludedClaimEn": "The NotebookLM synthesis is not the evidence for these sockets. JEDEC does not require one proprietary SPD bitcell, and neither standard turns live temperature telemetry or dynamic voltage compensation into a continuous NVM workload.",
          "excludedClaimZh": "NotebookLM 綜整不是這些應用位置的證據；JEDEC 並未強制 SPD 採用單一專有 bitcell，兩項標準也未把即時 temperature telemetry 或 dynamic voltage compensation 變成連續 NVM workload。",
          "validationNeededEn": "Qualify the target macro against capacity, endurance, PVT, write protection, atomic update, recovery and module- or PMIC-specific lifecycle requirements.",
          "validationNeededZh": "需依容量、耐久度、PVT、write protection、atomic update、recovery，以及 module／PMIC 特定 lifecycle 要求，驗證目標 macro。",
          "sourceLocator": "PDF pp4, 8",
          "relatedRecordIds": ["AI-NVM-DDR5-001", "AI-NVM-DDR5-002", "AI-NVM-PMIC-001", "AI-NVM-PMIC-002", "AI-NVM-VENDOR-002"],
          "isInference": true,
          "canonicalRecordEligible": false,
          "proofModeEligible": false,
          "sourceGroundedEligible": false
        },
        {
          "hypothesisId": "AI-NVM-HYP-NBLM-003",
          "titleEn": "Retimer persistence must be separated from live equalization",
          "titleZh": "Retimer 持久狀態必須與即時等化分開",
          "status": "VALIDATION_NEEDED",
          "evidenceClass": "VALIDATION_NEEDED",
          "assuranceMaturity": "Open",
          "statementEn": "Factory trim or a qualified cold-start profile may persist; live equalization and training remain volatile. Placement, medium and update cadence are product-specific.",
          "statementZh": "Factory trim 或 qualified cold-start profile 可能需要持久化；即時 equalization 與 training 維持揮發性，配置位置、媒體與更新頻率仍依產品而定。",
          "excludedClaimEn": "The synthesis does not prove that anti-fuse OTP is mandatory for every PCIe retimer or PHY.",
          "excludedClaimZh": "此綜整不能證明所有 PCIe retimer 或 PHY 都必須使用 AntiFuse OTP。",
          "validationNeededEn": "Verify the target retimer lifecycle, trim authority, training behavior, update count and recovery-time objective from primary documents.",
          "validationNeededZh": "需由一級文件驗證目標 retimer 的生命週期、trim authority、training 行為、更新次數與 recovery-time objective。",
          "sourceLocator": "PDF pp5, 8",
          "relatedRecordIds": ["AI-NVM-INF-002", "AI-NVM-VENDOR-001"],
          "isInference": true,
          "canonicalRecordEligible": false,
          "proofModeEligible": false,